{"schema_version":"1.0.0","artifact":"semantic-batch-promotion","run_mode":"CHANGE_SET","scope_receipt_sha256":"sha256:aaaaaaaaaaaaaaaaaaaaaaaaaaaaaaaaaaaaaaaaaaaaaaaaaaaaaaaaaaaaaaaa","plan_sha256":"sha256:bbbbbbbbbbbbbbbbbbbbbbbbbbbbbbbbbbbbbbbbbbbbbbbbbbbbbbbbbbbbbbbb","batch_id":"BATCH-000001","generation":1,"candidate_sha256":"sha256:cccccccccccccccccccccccccccccccccccccccccccccccccccccccccccccccc","result_schema_version":"2.0.0","result_sha256":"sha256:dddddddddddddddddddddddddddddddddddddddddddddddddddddddddddddddd","audit_sha256s":{"false_claim":"sha256:eeeeeeeeeeeeeeeeeeeeeeeeeeeeeeeeeeeeeeeeeeeeeeeeeeeeeeeeeeeeeeee","omission":"sha256:ffffffffffffffffffffffffffffffffffffffffffffffffffffffffffffffff"},"review_mode":"SEQUENTIAL","independence_attestation_sha256":null}
